"ตรีธารทิพย์/พิกัดตรีธารทิพย์, ยาต้ม","1","1","1","0.00"
"หลังคลอด (รพ.ตระการพืชผล), ยาต้ม","1","1","4","100.00"
"แก้คัน, ยาน้ำแขวนตะกอน","1","1","1","117.00"
"แก้เข่าบวม, ยาเข้าน้ำมัน","1","1","1","0.00"
"น้ำมันว่าน (วิทยาลัยการแพทย์แผนไทย ม.ราชมงคลธัญบุรี), ยาเข้าน้ำมัน","1","1","1","30.00"
"ขับพิษเบอร์ 1 , ยาแคปซูล","1","0","30","30.00"
"แคปซูลมะระขี้นก, ยาแคปซูล","1","0","30","30.00"
"บรรเทาริดสีดวงทวาร (ร้านเกรียงไกรเภสัช), ยาแคปซูล","1","0","30","52.50"
"ประสะน้ำนม (ศูนย์บริการทางการแพทย์แผนไทย ม.ราชมงคลอีสาน), ยาผง","1","1","1","50.00"
"แก้น้ำนมมาน้อย, ยาต้ม","1","1","1","0.00"
"แก้ลิ้นเป็นฝ้า, อื่นๆ","1","1","1","26.00"
"คลายเส้น (รพ.ตระการพืชผล), ยาแคปซูล","1","0","60","60.00"
"แคปซูลชุมเห็ดเทศ ตราช่อเขียวมะกอก, ยาแคปซูล","0","0","0","0.00"
"หลังคลอด (รพ.เอราวัณ), ยาต้ม","0","0","0","0.00"
"แก้ไอมะขามป้อม ตราเวชกร, ยาน้ำ","0","0","0","0.00"
"อมรสกานพลู, ยาลูกกลอน","0","0","0","0.00"
"เฮอร์ปิ เจล, เจล","0","0","0","0.00"
"แก้ไอผสมมะขามป้อม ตราวังหลัง, ยาน้ำ","0","0","0","0.00"
"แก้ไอกานพลู , ยาลูกกลอน","0","0","0","0.00"
"แก้โลหิตตังพิการ (รพ.ตระการพืชผล), ยาแคปซูล","0","0","0","0.00"
"น้ำมันกาสลัก, ยาเข้าน้ำมัน","0","0","0","0.00"
"ยาดมสมุนไพร เมืองศรีภูมิ, ยาดม","0","0","0","0.00"
"ฟีก้าครีม, ครีม","0","0","0","0.00"
"รักษาวัยทอง, ยาต้ม","0","0","0","0.00"
"เกสรทั้ง ๕, ยาต้ม","0","0","0","0.00"
"ตรีหอม , ยาแคปซูล","0","0","0","0.00"