"ชื่อยาสมุนไพร","จำนวนจ่ายรวมทุกสิทธิ(ครั้ง)","จำนวนจ่ายรวมสิทธิ UC(ครั้ง)","จำนวนที่จ่ายรวมทุกสิทธิ(หน่วยนับ)","มูลค่ารวมทุกสิทธิ(บาท)"
"อมมะแว้ง, ยาเม็ด","1,835,840","1,393,593","5,915,378","37,960,413.23"
"ขมิ้นชัน, ยาแคปซูล","1,660,327","1,234,434","58,974,783","329,903,542.15"
"ฟ้าทะลายโจร, ยาแคปซูล","1,313,471","996,057","30,872,679","93,732,940.59"
"ประสะมะแว้ง, ยาแคปซูล","1,267,801","971,560","3,930,681","26,020,445.47"
"แก้ไอมะขามป้อม, ยาน้ำ","1,101,598","821,664","1,437,302","32,769,952.76"
"แก้ไอผสมมะขามป้อม สูตรตำรับที่ 1, ยาน้ำ","736,642","579,301","914,971","20,482,488.59"
"เถาวัลย์เปรียง, ยาแคปซูล","579,197","469,881","15,657,492","46,677,495.23"
"มะขามแขก, ยาเม็ด","576,030","427,186","21,834,344","257,621,378.26"
"ยาประคบ, ยาประคบ","572,720","475,304","693,327","36,893,240.37"
"ไพล, ครีม","529,420","421,008","613,188","25,249,760.37"
"น้ำมันไพล, ยาเข้าน้ำมัน","445,573","361,140","494,173","18,610,504.58"
"ขี้ผึ้งไพล สูตรตำรับที่ 1, ขี้ผึ้ง","349,185","292,808","612,961","17,262,945.04"
"ธาตุอบเชย , ยาน้ำ","333,488","263,314","456,038","10,410,195.92"
"น้ำเชื่อมแก้ไอมะขามป้อม, ยาน้ำ","282,826","189,691","407,452","7,943,154.94"
"มะแว้ง, ยาแคปซูล","267,997","209,113","2,148,430,787","5,567,403.36"
"ไพลจีซาล , ครีม","216,475","174,335","254,793","13,993,665.11"
"พญายอ, ครีม","206,960","152,076","317,786","11,458,993.94"
"สหัศธารา, ยาแคปซูล","205,202","159,901","5,112,502","16,535,425.00"
"พริก, เจล","187,045","153,178","216,997","11,126,048.40"
"หม่องไพล/บาล์มไพล/ไพลบาล์ม / ขี้ผึ้งไพล, ขี้ผึ้ง","166,241","133,606","182,815","4,751,858.11"
"แก้ไอผสมมะขามป้อม สูตรตำรับที่ 2, ยาน้ำ","152,287","113,784","201,622","4,652,334.64"
"มะขามป้อม, ยาแคปซูล","127,408","87,820","193,363","3,647,319.22"
"แคปซูลเถาวัลย์เปรียง ตราเคเอ็มพี, ยาแคปซูล","116,794","89,634","3,050,174","13,255,115.72"
"แก้ไอผสมมะขามป้อม สูตรตำรับที่ ๒, ยาน้ำ","107,640","71,046","141,784","2,602,498.85"
"แก้ไอมะแว้งไล้ท์ ตราไอยรา, ยาน้ำ","88,628","64,507","126,269","2,563,808.10"
"หอมเทพจิตร, ยาเม็ด","85,556","62,004","1,055,181","5,282,306.16"
"น้ำยูอีคอฟ สูตร 2 , ยาน้ำ","85,480","64,001","111,471","2,140,308.21"
"รางจืด, ยาชง","84,390","65,223","780,171","5,490,126.32"
"ขี้ผึ้งไพล  สูตรตำรับที่ 2, ขี้ผึ้ง","84,322","63,851","93,149","2,787,614.69"
"หอมนวโกฐ, ยาผง","81,046","59,571","1,017,418","6,330,742.60"
"เพชรสังฆาต, ยาแคปซูล","79,205","57,332","3,293,222","11,398,652.57"
"มะระขี้นก, ยาแคปซูล","79,083","57,961","4,421,077","13,749,411.88"
"ลูกประคบสมุนไพรอินไทย, ยาประคบ","77,432","66,047","95,120","4,944,872.41"
"แคปซูลเพชรสังฆาต ตราเคเอ็มพี, ยาแคปซูล","74,476","53,219","2,342,392","6,329,417.92"
"แก้ไอมะแว้ง , ยาเม็ด","73,921","61,057","193,057","1,681,174.14"
"แก้ไอมะขามป้อม ตราไอยรา, ยาน้ำ","73,617","50,353","102,301","2,129,304.16"
"ลูกประคบสมุนไพรร้านหมอยาไทย 101, ยาประคบ","73,063","61,565","81,713","4,671,414.90"
"แก้ไอยูอีคอฟ ซีดี, ยาน้ำ","73,041","49,240","92,325","1,691,903.25"
"แก้ไอมะแว้งตราเคเอ็มพี , ยาน้ำ","66,001","46,348","174,158","1,802,178.08"
"ขิง, ยาแคปซูล","64,205","46,418","1,412,361","6,683,490.41"
"สมุนไพรอบตัว, ยาต้ม","62,291","53,041","73,124","3,876,792.79"
"แคปซูลเถาวัลย์เปรียง ตราธงทอง, ยาแคปซูล","54,642","37,882","1,584,307","13,403,914.05"
"ผสมเถาวัลย์เปรียง สูตรตำรับที่ 1, ยาลูกกลอน","53,616","46,097","1,378,847","3,142,646.49"
"ชุมเห็ดเทศ, ยาชง","52,255","38,077","704,961","2,875,747.40"
"คลายเส้น (พญาเม็งราย), ยาแคปซูล","49,394","43,632","1,209,529","1,602,367.50"
"แก้ไอผสมมะนาวดอง, ยาลูกกลอน","48,123","38,825","109,642","972,515.54"
"หญ้าหนวดแมว, ยาชง","43,171","31,170","629,073","11,713,733.91"
"หญ้าดอกขาว, ยาต้ม","43,143","33,364","491,982","11,643,129.78"
"จันทน์ลีลา, ยาแคปซูล","37,868","26,022","1,022,483","2,591,912.80"
"แก้ไอมะแว้งน้ำดำ, ยาน้ำ","36,636","29,414","44,871","1,238,431.70"
"ผสมเพชรสังฆาต สูตรตำรับที่ 1, ยาแคปซูล","34,407","26,684","1,408,543","3,531,814.66"
"ประสะไพล, ยาแคปซูล","34,382","24,689","1,039,343","5,448,509.77"
"หม่องเสลดพังพอน/เสลดพังพอนบาล์ม/หม่องพญายอ/ขี้ผึ้งพญายอ/ขี้ผึ้งเสลดพังพอน, ขี้ผึ้ง","31,759","22,212","39,734","1,138,988.26"
"แก้ไอมะแว้งน้ำเชื่อม, ยาน้ำ","30,124","23,139","35,769","973,859.90"
"ตรีผลา / พิกัดตรีผลา , ยาแคปซูล","29,751","17,946","917,109","3,488,766.12"
"มะขามแขกตราธงทอง, ยาเม็ด","28,962","19,659","1,674,244","2,575,359.30"
"ธาตุบรรจบ , ยาแคปซูล","28,436","19,151","523,755","1,598,783.38"
"ผสมเถาวัลย์เปรียง สูตรตำรับที่ 2, ยาลูกกลอน","27,111","23,270","579,777","1,514,921.43"
"บำรุงโลหิต, ยาแคปซูล","26,965","20,128","780,961","16,334,002.68"
"สหัสธารา, ยาแคปซูล","26,036","20,523","829,445","2,250,209.44"
"อมผสมมะแว้ง, ยาเม็ด","24,726","16,797","70,640","492,453.71"
"ธรณีสันฑะฆาต, ยาแคปซูล","24,511","16,436","775,909","7,063,347.95"
"แก้ไอมะแว้งตรา ที.เฮิร์บ, ยาน้ำ","24,310","19,229","42,691","382,837.90"
"ยาน้ำแก้ไอมะขามป้อม ตราเอมบริโคล, ยาน้ำ","24,017","17,614","27,423","546,803.25"
"คำฝอย, ยาชง","23,453","14,750","107,219","2,438,158.99"
"หม่องไพล ตราพระอินทร์, ขี้ผึ้ง","22,959","19,925","24,034","723,982.52"
"แก้ไอมะขามป้อมสูตร 1 , ยาลูกกลอน","22,710","17,322","29,759","707,354.50"
"ว่านหางจระเข้, เจล","21,954","15,243","31,578","1,293,620.98"
"น้ำมันกาสลัก, ยาเข้าน้ำมัน","21,805","20,235","22,242","1,027,224.00"
"เขียวหอม, ยาแคปซูล","20,748","15,648","291,262","1,193,058.57"
"กระเทียม, ยาแคปซูล","19,735","3,081","549,972","5,926,484.93"
"แก้ไอพื้นบ้านอีสาน, ยาน้ำ","19,551","16,190","23,046","619,968.90"
"เบญจกูล / พิกัดเบญจกูล, ยาแคปซูล","19,403","13,562","681,755","1,939,552.99"
"บัวบก, ครีม","18,966","9,751","134,583","2,608,588.72"
"ผสมเพชรสังฆาต สูตรตำรับที่ 2, ยาแคปซูล","18,276","13,876","798,820","1,333,095.24"
"ซินโนวอล, ยาน้ำ","17,110","13,215","33,718","503,562.45"
"ยาที่ปรุงสำหรับผู้ป่วยเฉพาะราย, อื่นๆ","16,838","12,743","101,404","3,189,426.00"
"หม่องสมุนไพร / หม่อง / หม่องแก้ปวด, ขี้ผึ้ง","16,295","13,638","17,225","381,640.00"
"แคปซูลผสมเถาวัลย์เปรียง ตราพระอินทร์, ยาแคปซูล","15,574","13,038","403,913","691,455.95"
"กระเจี๊ยบแดง, ยาชง","15,146","9,483","208,932","1,961,722.41"
"บรรเทาริดสีดวงทวารหนักเพชรสังฆาตชนิดแคปซูล, ยาแคปซูล","15,034","10,617","628,501","1,339,914.41"
"ยาแผนไทยที่ปรุงสำหรับผู้ป่วยเฉพาะราย, อื่นๆ","14,648","10,688","36,587","1,085,110.68"
"แก้ไอผสมมะขามป้อม สูตรตำรับที่ ๑, ยาน้ำ","14,423","9,020","22,257","434,952.00"
"บอระเพ็ด, ยาแคปซูล","14,254","10,273","384,120","1,288,216.33"
"ห้าราก / แก้ไข้ห้าราก / แก้วห้าดวง / เบญจโลกวิเชียร , ยาแคปซูล","12,925","9,586","313,267","886,886.31"
"คลายเส้น (รพ.กาบเชิง), ยาลูกกลอน","12,850","11,442","45,825","624,495.10"
"แก้ไอมะแว้งสูตร 1 , ยาเม็ด","12,683","9,255","34,787","257,775.15"
"แก้ไอมะแว้งตรามังกรทอง, ยาน้ำ","12,650","7,580","17,372","189,670.82"
"พิมเสนน้ำ, ยาน้ำ","12,493","7,230","17,524","537,540.50"
"น้ำมันเหลือง, ยาเข้าน้ำมัน","12,412","9,635","15,809","889,473.50"
"แคปซูลเพชรสังฆาต, ยาแคปซูล","11,165","7,623","449,056","2,423,922.89"
"อำมฤควาที, ยาผง","10,616","7,723","187,998","668,054.57"
"ครีมพริกไพล, ครีม","10,519","8,636","11,285","254,662.00"
"แลกซ์เซ่น ทีเอ็ม ชนิดเม็ด , ยาเม็ด","10,223","7,855","325,636","504,619.00"
"หอมอินทจักร, ยาผง","10,077","7,758","59,262","602,932.35"
"หอมบำรุงหัวใจ, ยาเม็ด","10,051","7,218","30,502","570,811.89"
"ปราบชมพูทวีป, ยาลูกกลอน","10,006","6,028","321,042","9,323,430.60"
"ธรณีสัณฑะฆาต, ยาแคปซูล","9,154","5,396","248,364","504,734.91"
"กล้วย, ยาผง","8,947","6,430","208,769","485,371.88"
"แก้ไอมะขามป้อมสูตร 2, ยาน้ำ","8,558","3,957","14,255","455,121.92"
"หอมทิพโอสถ, ยาผง","8,308","5,467","48,603","724,692.00"
"หอมทิพโอสถ ตราโพธิ์ทอง, ยาผง","7,922","5,603","9,319","337,187.40"
"ผสมโคคลาน สูตรตำรับที่ 2, ยาต้ม","7,920","6,976","12,818","259,701.35"
"กษัยเส้น ตราพรีราน่า, ยาแคปซูล","7,861","6,620","142,795","365,330.60"
"กล้วยขมิ้น, ยาแคปซูล","7,710","6,521","205,600","427,247.61"
"ขี้เหล็ก, ยาเม็ด","7,364","5,966","146,231","256,863.28"
"เลือดงาม, ยาแคปซูล","7,358","5,592","205,070","743,277.70"
"น้ำมันเหลืองตราพระอินทร์, ยาเข้าน้ำมัน","7,349","6,279","7,774","485,358.90"
"แก้ไอผสมกานพลู, ยาลูกกลอน","6,972","5,737","8,856","179,890.30"
"หม่องเสลดพังพอน/เสลดพังพอนบาล์ม/หม่องพญายอ/ขี้ผึ้งพญายอ/   ขี้ผึ้งเสลดพังพอน, ขี้ผึ้ง","6,695","4,337","8,512","236,234.59"
"หม่องตะไคร้/หม่องตะไคร้หอม, ขี้ผึ้ง","6,529","6,031","7,230","230,121.95"
"ไพลครีม  , ครีม","6,474","5,809","6,747","334,656.50"
"ส้มแขก, ยาแคปซูล","6,372","1,172","93,663","1,070,888.80"
"ขี้ผึ้งไพล สูตรตำรับที่ ๑, ขี้ผึ้ง","6,313","4,954","7,670","190,932.00"
"กษัยเส้น, ยาลูกกลอน","5,858","4,797","97,006","310,596.84"
"แก้ไอวิริยมัย สูตรมะขามป้อม, ยาน้ำ","5,812","2,715","8,912","138,363.50"
"บรรเทาอาการไอมะขามป้อม , ยาเม็ด","5,746","4,375","11,607","164,660.60"
"ทิงเจอร์ทองพันชั่ง, ทิงเจอร์","5,375","4,359","30,200","176,560.03"
"หม่องน้ำ, ยาน้ำ","5,334","3,465","6,710","162,697.00"
"ริดสีดวงมหากาฬ (ตำรับในระบบทางเดินอาหารส่วนกลางและส่วนปลาย), ยาแคปซูล","5,318","3,280","208,490","5,082,337.80"
"แคปซูลผสมเถาวัลย์เปรียง, ยาแคปซูล","5,254","3,830","127,133","369,861.10"
"ยาบรรเทาริดสีดวงทวาร  เพชรสังฆาต ชนิดแคปซูล, ยาแคปซูล","5,126","2,479","253,933","721,283.10"
"แก้ไอกานพลู , ยาลูกกลอน","4,825","3,545","29,726","109,829.80"
"น้ำมันเสลดพังพอน, ยาเข้าน้ำมัน","4,666","3,853","5,072","188,262.81"
"ผสมรางจืด หมอยาไทย, ยาผง","4,663","3,618","43,253","812,706.71"
"ยาหอม  , ยาผง","4,492","2,786","21,785","339,767.95"
"แคปซูลเถาเอ็นอ่อน, ยาแคปซูล","4,265","2,807","144,351","250,814.65"
"หญ้าปักกิ่ง, ยาแคปซูล","4,243","1,176","88,369","2,417,437.06"
"ปลูกไฟธาตุ, ยาลูกกลอน","4,183","3,470","79,795","285,099.20"
"แก้ไอสมุนไพร (รพ.กระบี่), ยาน้ำ","3,906","1,768","5,272","183,635.00"
"สตรีหลังคลอด, ยาต้ม","3,892","3,098","50,377","312,832.60"
"น้ำมันทาถูนวด , ยาเข้าน้ำมัน","3,862","3,636","4,018","120,695.00"
"ว่านชักมดลูก, ยาแคปซูล","3,689","2,093","106,229","420,504.17"
"ขี้ผึ้งสมุนไพร, ขี้ผึ้ง","3,287","2,820","3,347","88,708.00"
"น้ำยูอีคอฟ สูตร 1, ยาน้ำ","3,248","2,703","4,033","79,257.50"
"กันยุงตะไคร้หอม, ยาน้ำ","3,197","2,752","3,908","152,089.70"
"ทับหม้อเกลือ, ยาประคบ","3,153","2,949","3,158","140,753.00"
"พริกไทย, ยาแคปซูล","3,129","377","43,747","470,102.70"
"น้ำมันเถาเอ็นอ่อน, ยาเข้าน้ำมัน","3,051","112","6,988","717,152.00"
"เหลืองปิดสมุทร, ยาเม็ด","3,036","1,742","67,197","486,697.26"
"การ์ซิดีน, ยาน้ำ","2,977","502","3,157","154,553.00"
"ยาอมสมุนไพร ตราช่อเขียวมะกอก รสมะแว้ง, ยาเม็ด","2,904","1,644","3,650","36,977.50"
"แคปซูลรางจืด ตราธงทอง, ยาแคปซูล","2,859","2,219","74,114","157,399.35"
"กระชายดำ, ยาแคปซูล","2,728","260","40,692","666,146.50"
"อมฟ้าทะลายโจร, ยาลูกกลอน","2,723","1,868","3,743","41,840.20"
"แคปซูลผสมรางจืด ตราเคเอ็มพี, ยาแคปซูล","2,683","2,020","73,193","206,964.47"
"ยอ, ยาแคปซูล","2,593","916","38,928","351,843.40"
"แคปซูลบำรุงโลหิต ตราทีเอฟดี, ยาแคปซูล","2,576","1,607","126,551","205,789.50"
"แก้ลมอัมพฤกษ์ , ยาผง","2,530","1,708","20,531","158,055.35"
"แก้ไอสมุนไพร (รพ.วังน้ำเย็น), ยาลูกกลอน","2,476","1,988","2,616","81,910.56"
"ประสะจันทน์แดง , ยาแคปซูล","2,460","1,699","62,598","101,917.11"
"ตำรับโปร่งฟ้า , ยาแคปซูล","2,429","1,878","59,410","97,318.80"
"แคปซูลอบเชย, ยาแคปซูล","2,425","2,219","2,474","27,919.00"
"ผสมโคคลาน สูตรตำรับที่ 1, ยาชง","2,401","1,494","3,946","115,739.65"
"หอมสินธร, ยาผง","2,384","687","5,065","250,451.00"
"อมมะขามป้อม, ยาเม็ด","2,323","1,795","3,867","67,505.00"
"หม่องพริกไพล, ขี้ผึ้ง","2,291","1,582","2,827","89,955.00"
"ประสะกะเพรา, ยาแคปซูล","2,274","1,764","75,560","119,471.33"
"สเปรย์ตะไคร้หอม, ยาน้ำ","2,243","1,905","2,300","259,817.37"
"เซ็นนาฮอฟ, ยาแคปซูล","2,187","1,128","123,688","185,856.60"
"แก้ไอมะขามป้อม ตราอภัยภูเบศร สูตร 1 , ยาลูกกลอน","2,187","1,580","2,553","41,482.00"
"แก้ไอผสมมะขามป้อม ตราวังหลัง, ยาน้ำ","2,184","1,473","2,874","67,895.40"
"อมยูอีคอฟ , ยาเม็ด","2,141","1,459","3,449","37,929.50"
"ตรีธาตุ, ยาแคปซูล","2,135","1,848","7,162","212,826.85"
"แก้ไอมะแว้ง ตราปาริฉัตร, ยาน้ำ","2,128","1,466","2,837","78,544.50"
"แก้ไอยูอีคอฟ สูตร 3, ยาน้ำ","2,114","1,681","2,260","57,562.00"
"ประสะกานพลู , ยาเม็ด","2,072","1,604","39,888","63,966.25"
"มธุรเมหะ (รพ.วังน้ำเย็น), ยาลูกกลอน","2,008","1,718","275,462","609,366.00"
"ยาพอกเข่า, ยาน้ำแขวนตะกอน","2,004","1,078","2,472","171,121.50"
"ไพลซาบาล์ม , ขี้ผึ้ง","1,998","1,208","2,825","406,630.00"
"ตำรับโคคลาน, ยาแคปซูล","1,953","1,505","2,850","113,814.00"
"ยาอาบ   หมอยาไทย, ยาผง","1,895","1,607","1,944","128,442.00"
"กรีนครีม, ครีม","1,789","1,362","2,371","90,156.00"
"ตำรับระบายสมุนไพร, ยาแคปซูล","1,784","854","52,115","78,374.00"
"ไฟประลัยกัลป์, ยาแคปซูล","1,762","1,337","43,158","239,523.37"
"ถ่ายดีเกลือฝรั่ง , ยาแคปซูล","1,755","1,455","16,192","57,409.10"
"ตรีพิกัด, ยาแคปซูล","1,728","1,377","34,857","126,613.00"
"แคปซูลผสมเพชรสังฆาต, ยาแคปซูล","1,688","920","99,170","176,788.80"
"ฝาง, ยาต้ม","1,675","1,425","11,289","54,022.00"
"แก้ไอคัฟฟี, ยาน้ำ","1,649","1,508","2,039","42,568.88"
"หม่องพริก, ขี้ผึ้ง","1,631","1,327","1,815","68,666.50"
"มหาหิงคุ์, ยาน้ำ","1,575","1,347","1,666","33,135.74"
"แผลไฟไหม้น้ำร้อนลวก, เจล","1,532","1,004","1,857","53,169.25"
"หม่องขมิ้นชัน, ขี้ผึ้ง","1,519","1,108","2,348","51,539.75"
"แคปซูลผสมรางจืด, ยาแคปซูล","1,519","1,243","47,750","85,570.05"
"ขลู่, ยาชง","1,501","1,061","35,441","53,485.50"
"บรรเทาอาการริดสีดวงทวารหนักชนิดแคปซูล, ยาแคปซูล","1,483","1,037","100,368","176,085.30"
"ตำรับหญ้าหนวดแมว สูตร 1, ยาต้ม","1,465","1,359","4,119","51,919.32"
"เฮโมลอน 3, ยาแคปซูล","1,428","990","57,395","96,468.85"
"ชงสมุนไพรผสมรางจืด, ยาผง","1,410","1,174","5,605","51,823.95"
"ขี้ผึ้งเสลดพังพอนตราบักส์, ขี้ผึ้ง","1,394","1,200","1,501","42,212.00"
"เสลดพังพอนคาลาไมน์, โลชั่น","1,361","1,043","1,565","34,304.00"
"พลู, ครีม","1,352","1,070","1,629","87,077.47"
"มะรุม/ผักอีสุม



, ยาแคปซูล","1,338","73","48,693","379,403.20"
"ผสมโคคลาน สูตรตำรับที่ 3, ยาต้ม","1,301","1,151","1,573","71,105.00"
"ขมิ้นชันคาลาไมน์, โลชั่น","1,280","1,099","2,629","32,678.00"
"โคคลาน, ยาต้ม","1,176","626","54,642","94,904.40"
"อภัยสาลี, ยาลูกกลอน","1,175","872","70,856","170,969.00"
"แคปซูลผสมมะขามแขก ตราอภัยภูเบศร, ยาแคปซูล","1,171","733","13,903","76,232.45"
"หม่องเถาเอ็นอ่อน, ขี้ผึ้ง","1,168","52","3,372","125,905.00"
"เหงือกปลาหมอพริกไทย, ยาชง","1,136","756","22,677","82,702.10"
"อมสมุนไพรผสมมะแว้งรสบ๊วย, ยาเม็ด","1,120","979","3,961","18,290.50"
"แคปซูลรางจืด, ยาแคปซูล","1,110","937","23,972","112,991.02"
"อมแก้ไอรสบ๊วย     , ยาลูกกลอน","1,072","494","1,502","24,056.00"
"ตำรับชุมเห็ดเทศ, ยาชง","1,062","875","6,183","59,211.19"
"ประสะเจตพังคี, ยาแคปซูล","1,057","771","47,394","50,338.90"
"แก้ลมขึ้นเบื้องสูง, ยาแคปซูล","1,050","0","4,081","244,850.00"
"มธุรเมหะ (รพ.บางกระทุ่ม), ยาชง","1,025","0","4,244","144,120.00"
"ปัญจขันธ์, ยาแคปซูล","1,000","35","4,580","373,930.00"
"มันทธาตุ, ยาแคปซูล","983","488","37,001","131,198.64"
"น้ำแก้ไอมะขามป้อม ตราแสงดาว, ยาน้ำ","977","892","1,052","14,676.00"
"ถั่วเหลืองสกัด, ยาแคปซูล","958","542","77,722","158,457.00"
"ตะไคร้, ยาชง","937","292","2,426","92,454.50"
"ยาถ่าย (รพ.ห้วยพูล), ยาแคปซูล","922","475","11,667","78,154.00"
"แคปซิลเจล , เจล","916","573","1,569","86,295.00"
"มังคุด/เปลือกมังคุด, ครีม","914","724","12,398","40,804.85"
"โคเพนครีม, ครีม","909","755","934","23,908.25"
"เบอร์นีเจล, ครีม","903","726","1,116","42,744.99"
"อบเชย, ยาต้ม","885","818","919","14,446.50"
"ครีมพญายอ ตราไตรแว็ก, ยาครีมสำหรับป้ายปาก","884","618","1,161","53,846.00"
"ระบายมะขามแขก(ยาสามัญประจำบ้าน), ยาเม็ด","870","749","21,777","29,965.40"
"หม่องไพล, ขี้ผึ้ง","865","810","870","14,209.00"
"ขับลม แฟลท-ทัย , ยาน้ำ","851","709","867","19,916.75"
"เหงือกปลาหมอ, ยาชง","831","372","14,990","69,759.70"
"ใบหม่อน, ยาชง","827","237","3,869","52,266.00"
