"ริดสีดวงทวารแคปซูล สูตร 2, ยาแคปซูล","32","26","33","1,419.00"
"ประสะน้ำนม 2, ยาเม็ด","31","13","1,223","1,923.90"
"มุตกิต, ยาต้ม","31","0","143","239,890.00"
"คลายเส้น (รพ.กุดชุม), ยาลูกกลอน","31","26","1,010","1,907.00"
"เจลผสมพญายอ ตราไตรแว็ก, เจล","31","18","38","2,577.30"
"ตำรับกระเทียมแคปซูล, ยาแคปซูล","30","11","5,793","11,586.00"
"แคปซูลผสมกระเทียม ตราพระอินทร์, ยาแคปซูล","30","8","490","2,955.00"
"ขิปปะกะโอสถ, ยาแคปซูล","29","22","1,080","2,160.00"
"หอมระย่อม, ยาแคปซูล","29","23","1,302","2,195.20"
"ทิพย์เกสร, ยาแคปซูล","28","6","6,762","4,627,470.00"
"อินทรีย์ธาตุประชุม, ยาแคปซูล","26","25","2,912","5,824.00"
"เซนน่า, ยาแคปซูล","25","23","570","771.40"
"ขับพิษสูตร 2, ยาผง","25","24","25","1,875.00"
"แคปซูลอบเชย ตราธงทอง, ยาแคปซูล","25","16","334","1,009.00"
"แคปซี บาล์ม, ขี้ผึ้ง","24","2","26","1,248.00"
"แก้แผลร้อนใน ทีเอฟดี, ยาผง","22","19","1,360","2,040.00"
"แคปซูลพริกไทยดำ, ยาแคปซูล","22","11","2,650","2,490.00"
"น้ำมันไพลมะกรูด, ยาเข้าน้ำมัน","22","17","26","2,130.70"
"ทับทิม, ยาชง","21","15","31","199.00"
"หลังคลอด, ยาต้ม","21","14","31","2,579.00"
"บรรเทาอาการขัดเบา, ยาผง","20","16","260","260.00"
"บำรุงโลหิตเบอร์ 71, ยาเม็ด","19","8","570","855.00"
"ฟีก้าครีม, ครีม","19","15","21","710.00"
"ทิงเจอร์พญายอ, ทิงเจอร์","19","17","22","492.00"
"ยาดมสมุนไพร เมืองศรีภูมิ, ยาดม","19","12","47","1,030.00"
"ทับทิมไทย, ยาแคปซูล","19","12","23","125.58"
"แคปซูลขมิ้นเครือ, ยาแคปซูล","18","17","338","676.00"
"แคปซูลหญ้าหนวดแมว ตราธันยพรสมุนไพร, ยาแคปซูล","18","3","1,884","2,643.00"
"น้ำมันทาแก้คัน, ยาเข้าน้ำมัน","18","8","20","1,000.00"
"กษัยเบอร์ 2, ยาแคปซูล","17","11","1,150","1,465.00"
"ผสมโคคลาน สูตรตำรับที่ ๒, ยาต้ม","17","17","17","469.00"
"สัตถกวาตะ, ยาแคปซูล","17","12","1,111","735.50"
"ลดไขมันในเส้นเลือด สูตร 2, ยาแคปซูล","17","17","1,570","1,690.00"
"แก้มดลูกอักเสบ , ยาแคปซูล","16","2","4,455","3,326,062.50"
"ผสมเถาวัลย์เปรียง สูตรตำรับที่ ๑, ยาแคปซูล","16","4","422","0.00"
"กานพลูผสมหญ้าดอกขาว, ยาน้ำ","16","12","16","800.00"
"แคปซูลเพชรสังฆาต ตราธันยพรสมุนไพร, ยาแคปซูล","16","10","500","935.00"
"ลม เบอร์ 66, ยาแคปซูล","15","5","1,794","1,557.00"
"แก้ทรางตานขโมย, อื่นๆ","14","7","118","415.00"
"อาบสมุนไพร, ยาต้ม","14","0","28","1,820.00"
"หอมเบอร์ 79, ยาเม็ด","14","7","1,180","1,770.00"
"แคปซูลผสมเพชรสังฆาต ตราปาริฉัตร, ยาแคปซูล","14","8","290","430.80"
"น้ำมันไพลผสมใบบักบก ตราโกมุทประสานกาย, ยาเข้าน้ำมัน","13","13","13","830.00"
"เขียวหอมใหญ่, ยาผง","13","12","17","765.00"
"แก้ลูกอ่อน / ลูกแก่ , ยาต้ม","13","0","70","17,842.00"
"บำรุงโลหิตสตรี, ยาแคปซูล","12","9","17","340.00"
"ขมิ้นอ้อย, ยาแคปซูล","12","2","13","910.00"
"บรรเทาริดสีดวงทวาร (อายุรเวทศิริราช), ยาผง","11","0","231","150.15"
"ผสมเพชรสังฆาต สูตรตำรับที่ ๑, ยาแคปซูล","11","8","190","285.00"
"ตำรับแก้ลมขึ้นเบื้องสูง, ยาต้ม","11","10","11","550.00"
"กษัยเบอร์ 50, ยาแคปซูล","11","8","450","342.00"
"ผงโยคี ของบริษัทโยคี (1997) จำกัด, ยาผง","11","0","517","336.05"
"ยาถ่าย (รพ.พานทอง), ยาแคปซูล","11","8","605","1,260.00"
"หลังคลอด (รพ.เอราวัณ), ยาต้ม","11","3","15","600.00"
"แองจูลา แคปซูล, ยาแคปซูล","10","7","154","154.00"
"แก้อันตังพิการ , ยาแคปซูล","10","0","1,860","1,301,400.00"
"หม่องสมุนไพร ตราไอยรา, ขี้ผึ้ง","10","10","10","250.00"
"แคปซูลดอกคำฝอย, ยาแคปซูล","10","3","17","1,190.00"
"ยาถ่าย สูตร 3, ยาผง","10","9","100","200.00"
"มธุรเมหะ (รพ.เทิง), ยาแคปซูล","10","10","3,240","6,480.00"
"ลม เบอร์ 65, ยาแคปซูล","9","7","1,020","612.00"
"บอระเพ็ดพุงช้าง, ยาแคปซูล","9","1","13","1,300.00"
"แก้หทัยวาตะ, ยาแคปซูล","9","0","1,440","712,800.00"
"ยากระตุ้นน้ำนม, ยาต้ม","9","1","214","435.00"
"หอมเบอร์ 24, ยาแคปซูล","9","5","776","1,068.00"
"บำรุงโลหิตชนิดแคปซูล, ยาแคปซูล","9","4","211","221.55"
"แก้ปวดเมื่อย, ยาต้ม","8","8","15","345.00"
"แคปซูลว่านชักมดลูก ตราสามหมี, ยาแคปซูล","8","8","185","70.30"
"เขียว เบอร์ 15, ยาชง","8","0","754","188.50"
"แคปซูลว่านชักมดลูก ตราธันยพรสมุนไพร, ยาแคปซูล","8","2","10","830.00"
"บรรเทาริดสีดวงทวาร , ยาเม็ด","7","0","350","525.00"
"หลังคลอด (รพ.พิษณูโลก), ยาผง","7","4","7","330.00"
"ครอบไข้, ยาต้ม","7","3","16","1,440.00"
"ประคบใบหน้า/เต้านม, ยาประคบ","6","2","13","625.00"
"บำรุงน้ำนม (รพ.พนา), ยาชง","6","4","12","360.00"
"หม่องน้ำมันว่าน, ขี้ผึ้ง","6","5","7","308.00"
"แคปซูลใบแปะก๊วย, ยาแคปซูล","6","0","7","595.00"
"บำรุงเลือด (สถาบันวิจัยการแพทย์แผนไทย), ยาแคปซูล","6","1","300","450.00"
"แคปซูลบำรุงน้ำนม, ยาแคปซูล","6","6","173","524.40"
"บรรเทาหวัดแพ้อากาศ , ยาแคปซูล","6","0","250","500.00"
"แดงสีเสน, ยาแคปซูล","6","6","380","380.00"
"หอมเบอร์ 20 , ยาแคปซูล","5","2","390","381.00"
"ถอนพิษประดง, ยาเม็ด","5","2","310","310.00"
"เจลผสมพญายอ เอส.บี., เจล","5","5","5","175.00"
"อบหลังคลอด, ยาต้ม","4","2","6","710.00"
"ระบายเบอร์ 9 , ยาแคปซูล","4","4","33","165.00"
"พนาเพรียว , ยาแคปซูล","4","0","390","483.00"
"แคปซูลบอระเพ็ด ตราธันยพรสมุนไพร, ยาแคปซูล","4","0","5","377.50"
"มะรุมสกัดชนิดเม็ดเครื่องหมายการค้าขาวละออ, ยาเม็ด","4","0","400","652.00"
"ปทุมเกสรา , ยาต้ม","4","0","15","17,582.00"
"หอมชนิดผง ตราหินทอง, ยาผง","4","4","4","120.00"
"บำรุงเลือด, ยาต้ม","4","3","180","288.00"
"กวาดสมานลิ้น(ยาสามัญประจำบ้าน), ยาผง","4","4","6","47.30"
"พอกสมุนไพรสูตรร้อน, ยาผง","4","0","22","660.00"
"บำรุงโลหิตเบอร์ 30 , ยาแคปซูล","3","0","360","360.00"
"น้ำมันว่าน (รพ.ละงู), ยาเข้าน้ำมัน","3","3","3","104.46"
"แคปซูลชุมเห็ดเทศ ตราช่อเขียวมะกอก, ยาแคปซูล","3","3","3","120.00"
"พอกสมุนไพรสูตรเย็น, ยาผง","3","0","18","540.00"
"ตำรับหญ้าขัดมอญ สูตร 1, ยาต้ม","3","3","9","117.00"
"แก้ปัสสาวะพิการ, ยาต้ม","3","0","211","137.15"
"แก้ตานซางสูตร 1, ยาต้ม","3","0","7","3,111.00"
"ผงชาพยัพเมฆ ตราลูกไก่คู่, ยาผง","3","0","15","23.40"
"ชลบาล์มแก้ปวด, ขี้ผึ้ง","3","3","21","189.00"
"แก้ทุราวาสา , ยาต้ม","3","0","6","1,788.00"
"กระชาย, ยาต้ม","2","1","2","5.00"
"หม่องพญายอ, ขี้ผึ้ง","2","0","2","50.00"
"บำรุงเลือด (ศูนย์บริการทางการแพทย์แผนไทย ม.ราชมงคลอีสาน), ยาผง","2","0","2","60.00"
"ยาอาบสำหรับหญิงหลังคลอด, ยาต้ม","2","0","6","294.00"
"แคปซูลกวาวเครือขาว, ยาแคปซูล","2","0","2","322.00"
"ขับพิษเบอร์ 1 , ยาแคปซูล","2","2","40","120.00"
"น้ำมันว่าน (วิทยาลัยการแพทย์แผนไทย ม.ราชมงคลธัญบุรี), ยาเข้าน้ำมัน","2","2","2","88.00"
"แก้กษัยเส้น(รพ.ท่าแพ), ยาแคปซูล","2","2","80","80.00"
"ขับลมเบอร์ 39, ยาแคปซูล","2","2","60","72.00"
"ยาพอกดูดพิษ, ยาพอก","2","0","4","268.00"
"แก้ลิ้นเป็นฝ้า, อื่นๆ","2","2","2","48.00"
"แก้หวัด-แพ้อากาศ, ยาแคปซูล","2","2","40","66.80"
"ตำรับแก้น้ำนมพิการ, ยาน้ำ","2","2","2","80.00"
"ถอนพิษไข้, ยาแคปซูล","2","2","2","6.00"
"บรรเทาริดสีดวงทวาร สูตร 1 , ยาแคปซูล","2","2","31","46.50"
"แก้น้ำนมพิการสูตร 1 , ยาต้ม","2","1","3","150.00"
"สมมิทธกุมารใหญ่ (รพ.พระปกเกล้า), ยาเม็ด","1","0","450","202,500.00"
"เทพธารา (ศูนย์บริการทางการแพทย์แผนไทย ม.ราชมงคลอีสาน), ยาแคปซูล","1","1","10","100.00"
"หญ้าสาบเสือ, ครีม","1","0","3","67.50"
"หนุมานประสานกาย, ยาแคปซูล","1","0","3","3.00"
"แก้เวียนศีรษะ, ยาแคปซูล","1","0","20","30.00"
"แก้ท้องเสียเบอร์ 6, ยาเม็ด","1","1","60","90.00"
"นันทไกรวาทน้อย, ยาเม็ด","1","0","450","202,500.00"
"ธาตุผสมอบเชย, ยาน้ำ","1","0","1","52.50"
"หม่องสุคนธ์ทิพย์, ขี้ผึ้ง","1","1","1","20.00"
"ยาดมโบราณ, ยาดม","0","0","0","0.00"
"แก้ไข้บอระเพ็ด แคปซูล, ยาแคปซูล","0","0","0","0.00"
"มหาวัฒนะ   , ยาแคปซูล","0","0","0","0.00"
"ผสมมะขามแขก, ยาแคปซูล","0","0","0","0.00"
"ตำรับลูกใต้ใบ  , ยาต้ม","0","0","0","0.00"
"แองเจลิน่า แคปซูล, ยาแคปซูล","0","0","0","0.00"
"น้ำมันแก้มังสังพิการ, ยาเข้าน้ำมัน","0","0","0","0.00"
"ยาพอกลดบวม, ยาผง","0","0","0","0.00"
"มธุรเมหะ (อายุรเวทศิริราช), ยาแคปซูล","0","0","0","0.00"
"แก้ไอผสมมะแว้ง ตราวังหลัง, ยาน้ำ","0","0","0","0.00"
"สตรีเล่งคุณสำหรับหลังคลอดบุตร, ยาน้ำ","0","0","0","0.00"
"บรรเทาริดสีดวงทวาร (ร้านเกรียงไกรเภสัช), ยาแคปซูล","0","0","0","0.00"
"แก้บุพโพพิการเบอร์ 2, ยาพอก","0","0","0","0.00"
"ผสมกระเทียม, ยาแคปซูล","0","0","0","0.00"