"มธุรเมหะ (รพ.สมเด็จพระยุพราชสายบุรี), ยาต้ม","823","667","1,835","80,714.50"
"คลายเส้น, ยาแคปซูล","820","798","6,877","29,610.00"
"แก้ไอมะแว้งสูตร 2, ยาเม็ด","815","679","1,116","23,462.50"
"ยาถ่าย, ยาเม็ด","814","697","23,616","56,815.80"
"น้ำมันสะเก็ดเงิน, ยาเข้าน้ำมัน","781","154","6,227","3,675,679.00"
"เจลเสลดพังพอน, เจล","771","44","846","49,380.00"
"ตำรับเบาหวาน, ยาแคปซูล","736","565","37,858","245,028.90"
"ขี้ผึ้งไพล สูตรตำรับที่ ๒, ขี้ผึ้ง","720","639","720","54,000.00"
"ใบเตย, ยาชง","690","50","2,530","91,856.40"
"แก้ไอมะนาว, ยาน้ำ","677","198","1,222","33,185.00"
"แป๊ะก๊วย, ยาแคปซูล","668","69","3,338","153,097.00"
"แก้เจ็บคอ , อื่นๆ","666","454","13,734","15,912.24"
"ไฟห้ากอง , ยาแคปซูล","665","443","33,031","41,987.55"
"แก้ไอ สูตร 1, ยาลูกกลอน","651","508","736","21,789.00"
"กานพลู, อื่นๆ","646","321","1,513","16,557.00"
"ชะเอมเทศ, ยาชง","642","466","7,448","19,786.85"
"เฮโมลอน, ยาแคปซูล","631","434","24,676","38,635.40"
"ยากระเพาะอาหาร, ยาแคปซูล","618","530","13,372","22,259.60"
"แก้ปวดกล้ามเนื้อ, ยาแคปซูล","607","557","11,732","15,314.40"
"แคปไซ-ไพลบาล์ม, ขี้ผึ้ง","601","59","627","31,785.00"
"แก้ไอน้ำฝาง, ยาน้ำแขวนตะกอน","599","557","599","8,985.00"
"พระขรรค์ชัย, ยาลูกกลอน","593","8","60,334","48,443,681.00"
"เห็ดหลินจือ/เห็ดขอนไม้, ยาแคปซูล","584","247","16,628","247,136.20"
"แก้กษัย, ยาแคปซูล","583","364","22,285","44,570.00"
"เทพธารา (รพ.อู่ทอง), ยาแคปซูล","576","439","10,999","28,320.00"
"น้ำยาบ้วนปากสมุนไพร, ยาน้ำ","574","481","904","19,264.74"
"น้ำมันไพลขมิ้น, ยาเข้าน้ำมัน","566","413","7,595","52,872.00"
"คลายกล้ามเนื้อ, ยาแคปซูล","565","330","929","41,350.00"
"แก้น้ำนมพิการ(รพ.กาบเชิง), ยาผง","555","299","1,485","28,116.90"
"ช่วยย่อยอาหาร สูตร 1, ยาแคปซูล","553","489","737","7,705.00"
"หลังคลอด (รพ.กาบเชิง), ยาต้ม","551","354","925","90,089.50"
"บรรเทาริดสีดวงทวาร (รพ.เทิง), ยาแคปซูล","548","368","27,621","49,997.70"
"ดีบัว, ยาแคปซูล","538","65","1,282","245,400.00"
"พญายอครีม   , ครีม","533","410","655","38,129.68"
"บรรเทาริดสีดวงทวาร (รพ.ห้วยยอด), ยาลูกกลอน","531","415","44,495","35,137.00"
"ประสะน้ำนม (บริษัทพาราฟาร์มาซูติคอล จำกัด), ยาเม็ด","528","436","15,249","99,846.00"
"แก้ไข้หวัด, ยาแคปซูล","523","423","13,544","24,477.50"
"พลูคาว, ยาแคปซูล","506","6","1,555","388,030.00"
"หม่องสมุนไพร หนองฉางบาล์ม, ขี้ผึ้ง","495","6","1,040","35,240.00"
"แอนดิแลค, ยาแคปซูล","492","410","20,970","32,447.40"
"สมุนไพรคำฝอยผสมเก๊กฮวย, ยาชง","490","18","10,999","66,756.80"
"วัฒนะ, ยาแคปซูล","485","75","4,305","54,930.00"
"น้ำมันมะกอก, ยาเข้าน้ำมัน","479","372","582","44,605.34"
"ทิงเจอร์พลู, ทิงเจอร์","468","381","496","14,379.70"
"ขับลมเบอร์ 1    , ยาแคปซูล","467","432","14,776","17,270.40"
"ประสะน้ำนม ทีเอฟดี, ยาแคปซูล","466","361","16,080","27,962.10"
"แก้ไอมะขามป้อม ตราเวชกร, ยาน้ำ","463","422","470","9,662.00"
"แคปซูลบอระเพ็ด, ยาแคปซูล","455","277","15,628","24,693.00"
"อมแก้ไอมะแว้ง, ยาลูกกลอน","452","407","522","5,749.16"
"ผสมรางจืด, ยาชง","449","332","3,863","33,922.00"
"ตำรับหญ้าหนวดแมว สูตร 2, ยาต้ม","445","386","1,135","35,920.50"
"น้ำมันพริกไพล, ยาเข้าน้ำมัน","437","369","462","18,485.50"
"แก้ไอมะขามป้อม ตราอภัยภูเบศร สูตร 2, ยาลูกกลอน","433","362","598","11,940.00"
"แคปซูลขับลมบำรุงธาตุ, ยาแคปซูล","431","380","10,525","15,167.80"
"ภูมิชีวา  , ยาแคปซูล","427","0","1,592","95,520.00"
"บรรเทาริดสีดวงทวาร (รพ.พระปกเกล้า), ยาแคปซูล","421","375","8,400","16,800.00"
"แคปซูลดอกคำฝอย ตราธงทอง, ยาแคปซูล","408","331","14,486","21,411.00"
"หญ้าลูกใต้ใบ, ยาแคปซูล","407","154","19,157","38,174.85"
"อบหลังคลอด  หมอยาไทย, ยาผง","393","327","445","21,699.10"
"เบญจอำมฤตย์ , ยาแคปซูล","389","58","32,436","265,076.00"
"หม่องฟ้าทะลายโจร, ขี้ผึ้ง","383","7","735","26,005.00"
"กำจัดเหา, ยาน้ำแขวนตะกอน","382","318","492","27,319.00"
"แก้ลสิกาพิการ, ยาเข้าน้ำมัน","382","3","1,092","397,800.00"
"น้ำมันเขียว, ยาเข้าน้ำมัน","380","12","735","87,010.00"
"แก้อัมพฤกษ์ อัมพาต(กาบเชิง), ยาผง","377","341","574","23,753.00"
"ยาระบายชนิดน้ำผสมฝักคูณ, ยาน้ำ","377","161","1,036","58,058.20"
"บำรุงน้ำนม, ยาต้ม","375","263","1,188","46,609.50"
"พอนส์ทั่ม, ยาแคปซูล","366","271","13,950","22,109.80"
"ชงสมุนไพรผสมช้าพลู, ยาผง","364","158","1,832","178,984.00"
"ดองมะกรูด แผนไทย, ยาน้ำ","355","0","1,034","93,060.00"
"บำรุงเลือด (รพ.สรรคบุรี), ยาแคปซูล","355","14","43,560","86,001.40"
"แก้ไอมะขาม , ยาน้ำ","346","156","636","17,170.00"
"คลายเส้น สูตร 1, ยาแคปซูล","346","11","38,160","71,695.00"
"บรรเทาริดสีดวงทวาร สูตร 2, ยาแคปซูล","346","188","7,926","26,366.50"
"แก้เริม งูสวัด /แก้เริม งูสวัด สุกใส, ยาน้ำ","340","274","427","13,502.00"
"ขับลมเบอร์ 2, อื่นๆ","338","234","376","14,371.00"
"แก้แพ้อากาศ, ยาลูกกลอน","338","210","24,506","41,695.00"
"แคปซูลผสมใบบัวบก, ยาแคปซูล","333","56","5,500","20,570.50"
"น้ำมันสมุนไพร, ยาเข้าน้ำมัน","328","292","6,471","19,333.50"
"ยาระบายส้มแขกชนิดเม็ด เครื่องหมายการค้าดอกว่าน, ยาเม็ด","324","276","18,462","29,164.50"
"ชงกระเจี๊ยบ, ยาชง","324","183","5,229","25,531.55"
"แคปซูลสมุนไพรผสมเพชรสังฆาต, ยาแคปซูล","323","193","13,131","27,339.25"
"ผสมเพชรสังฆาต, ยาแคปซูล","319","247","12,505","29,379.90"
"ระย่อมลมสูง, ยาแคปซูล","315","18","927","254,280.00"
"แห้ม/แฮ่ม, ยาแคปซูล","305","8","804","68,178.00"
"ผสมเพชรสังฆาตสูตรตำรับที่ 1, ยาแคปซูล","304","130","19,117","24,817.50"
"มธุรเมหะ (รพ.อู่ทอง), ยาแคปซูล","299","248","64,150","134,630.00"
"ลูกใต้ใบ เครื่องหมายการค้าดอกว่าน, ยาเม็ด","299","175","79,825","119,737.50"
"โบโม่ ออรัลเจล, เจล","297","230","549","5,516.00"
"แก้ปวดเมื่อย สูตรอภัยภูเบศร, ยาต้ม","280","34","856","203,200.00"
"อัมรินทร์, ยาแคปซูล","276","96","8,642","36,449.25"
"มหาจักรใหญ่, ยาผง","257","42","14,607","12,237.85"
"ลดไข้เบอร์ 1, ยาแคปซูล","256","240","4,593","5,378.00"
"แก้ไอสมุนไพรส้ม, ยาลูกกลอน","255","14","546","5,717.00"
"ครีมไพล, ครีม","254","166","252","12,600.00"
"ขางกินดูกข้อเอ็น  , ยาแคปซูล","249","184","31,506","63,012.00"
"บรรเทาริดสีดวงทวาร ชนิดแคปซูล, ยาแคปซูล","247","212","7,210","13,873.66"
"หม่องสูตรไพล ตราบี-บาล์ม, ขี้ผึ้ง","245","57","412","20,188.00"
"หอมหทัยทิพย์, ยาผง","244","90","538","36,584.00"
"เถาเอ็นอ่อน, ยาแคปซูล","242","68","10,184","25,830.00"
"ยาธาตุชนิดแคปซูล ร้านเจริญสุขกรุ๊ป, ยาแคปซูล","242","104","17,378","26,067.00"
"แก้ไอมะกรูด, ยาน้ำ","241","29","623","18,690.00"
"บรรเทาอาการปวดเมื่อยตามร่างกาย, ยาเม็ด","236","217","9,615","15,627.75"
"กล่อมนางนอน, ยาแคปซูล","235","10","39,392","79,344.00"
"แคปซูลหญ้าปักกิ่ง, ยาแคปซูล","225","84","9,482","41,653.00"
"บุก, ยาแคปซูล","220","2","8,284","32,840.00"
"อายุวัตนะ , ยาแคปซูล","210","166","5,788","8,998.70"
"ยาผสมหมามุ่ย, ยาแคปซูล","209","0","455","68,250.00"
"ผสมโคคลาน สูตรตำรับที่ ๓, ยาต้ม","206","185","207","8,238.00"
"กษัยเบอร์ 1, ยาแคปซูล","204","0","20,330","30,495.00"
"ตำรับกษัยเส้น, ยาต้ม","193","0","15,168","9,100.80"
"หลังคลอด (รพ.สูงเนิน), ยาต้ม","193","71","247","17,560.00"
"ประสะน้ำนม 1, ยาแคปซูล","186","81","9,400","18,948.00"
"คลายเส้น (รพ.ห้วยทับทัน), ยาต้ม","184","166","185","11,641.00"
"วรรณฉวี , ยาต้ม","184","3","11,307","25,033,840.50"
"แก้นหารูพิการ , ยาแคปซูล","178","0","39,460","24,407,000.00"
"แก้พัทธะปิตตะ , ยาต้ม","176","2","705","1,110,364.00"
"แก้ไอสมุนไพรบ๊วย, ยาลูกกลอน","174","4","348","3,610.50"
"ส้มโอมือ, ยาผง","174","66","181","10,613.00"
"คลายเส้น (รพ.ตระการพืชผล), ยาแคปซูล","171","65","3,493","12,202.70"
"แก้ตะโจพิการ , ยาผง","171","163","377","9,652.00"
"นมนาง, ยาต้ม","164","1","837","17,585.00"
"ดมสมุนไพร, ยาดม","163","109","165","4,675.50"
"บำรุงเลือด (รพ.บ้านนา), ยาแคปซูล","162","2","328","26,240.00"
"สมุนไพรคำฝอย โกฐหัวบัว, ยาชง","156","147","806","7,600.00"
"เทพรังษี  , ยาต้ม","156","2","612","951,232.00"
"ยาดมสมุนไพร, ยาดม","156","48","186","5,319.75"
"ข่า, เจล","152","127","208","3,439.50"
"บำรุงเลือด (รพ.พนัสนิคม), ยาแคปซูล","151","123","1,838","12,178.00"
"แคปซูลกระชายดำ, ยาแคปซูล","150","126","3,128","22,237.00"
"กวาดสมานลิ้นขาวละออเภสัช ชนิดผง, ยาผง","148","136","209","2,002.30"
"แก้โรคผิวหนัง ตำรับที่ 2, ยาน้ำ","146","0","1,107","912,133.00"
"แก้ท้องเสีย, อื่นๆ","145","115","1,859","3,156.00"
"ประสะเปราะใหญ่, ยาผง","142","101","2,877","6,825.01"
"คลายเส้น สูตร 2, ยาแคปซูล","141","8","17,360","19,735.00"
"แก้กษัยแคปซูลสูตร 1, ยาแคปซูล","137","132","2,120","4,240.00"
"เพกา, ยาแคปซูล","135","5","423","49,038.00"
"แก้กษัยสูตร 1 , ยาต้ม","135","59","2,035","309,044.00"
"ผิดสำแดง, ยาต้ม","131","119","138","2,580.00"
"แก้โลหิตตังพิการ (รพ.เรณูนคร), ยาแคปซูล","131","44","491","46,700.00"
"ขี้ผึ้งตราโอสถทิพย์, ขี้ผึ้ง","131","118","131","3,676.00"
"แก้ปิหกังพิการ, ยาแคปซูล","125","0","29,085","18,611,062.50"
"ทิพย์โอสถ, ยาลูกกลอน","124","70","2,833","1,211,165.00"
"บรรเทาริดสีดวงทวาร (รพ.พล), ยาแคปซูล","124","109","2,838","4,769.00"
"อมรสกานพลู, ยาลูกกลอน","123","79","3,794","92,671.96"
"อมรสบ๊วย, ยาลูกกลอน","123","48","175","2,923.40"
"แก้น้ำนมพิการ(รพ.กุดชุม), ยาผง","121","99","134","3,532.00"
"เกสรทั้ง 5, ยาชง","121","0","206","6,180.00"
"น้ำมันคลายกล้ามเนื้อ, ยาเข้าน้ำมัน","119","1","120","7,160.00"
"บำรุงน้ำนม สูตรอภัยภูเบศร, ยาต้ม","119","21","201","19,375.00"
"ตรีกฏุก, ยาแคปซูล","118","10","316","69,840.00"
"แก้ไอสมุนไพรฟ้าทะลายโจร, ยาลูกกลอน","117","0","244","2,503.50"
"มธุรเมหะ (รพ.กาบเชิง), ยาต้ม","117","81","200","7,438.00"
"แคปซูลขิง ตราช่อเขียวมะกอก, ยาแคปซูล","109","85","2,057","10,773.40"
"หลังคลอด (รพ.ตระการพืชผล), ยาต้ม","109","86","109","13,873.00"
"ประสะน้ำนม (ศูนย์บริการทางการแพทย์แผนไทย ม.ราชมงคลอีสาน), ยาผง","108","104","176","6,336.00"
"ผสมเถาวัลย์เปรียง สูตรตำรับที่ ๒, ยาแคปซูล","107","99","1,723","2,381.90"
"แก้คัน, ยาน้ำแขวนตะกอน","105","76","109","10,523.00"
"ขมเม็ดน้ำเต้าทอง, ยาเม็ด","104","61","1,562","1,562.00"
"ขี้ผึ้งผสมพญายอ, ขี้ผึ้ง","103","55","127","5,199.25"
"อายุวัฒนะ, ยาลูกกลอน","103","63","388","6,939.70"
"บำรุงเลือด (รพ.เทิง), ยาแคปซูล","100","91","1,857","2,777.10"
"ตำรับโลดทะนงแดง  , ยาผง","98","34","218","14,808.00"
"แก้เรื้อนมูลนก, ยาเข้าน้ำมัน","97","2","971","883,951.00"
"ตำรับบัวบก, ยาลูกกลอน","96","72","834","5,921.52"
"ยาอมสมุนไพร ตราช่อเขียวมะกอก รสกานพลู, ยาเม็ด","96","46","177","5,533.80"
"พอกสมุนไพร, ยาพอก","96","24","3,442","10,779.85"
"แก้โรคผิวหนัง ตำรับที่ 1, ยาแคปซูล","95","3","22,900","16,901,125.00"
"ฝรั่ง, ยาน้ำ","95","78","365","2,123.75"
"วาโย 6, ยาแคปซูล","95","13","451","10,935.00"
"แก้ลมจับโปง , ยาต้ม","91","0","368","581,704.00"
"ตำรับตะแบกป่า , ยาต้ม","91","68","4,951","7,720.50"
"แก้ฝีมะเร็งทรวง, ยาน้ำแขวนตะกอน","89","44","266","47,880.00"
"แก้ยกนังพิการสูตร 2, ยาแคปซูล","88","0","26,525","22,690,562.50"
"ยาทาสะเก็ดเงิน, ขี้ผึ้ง","87","70","422","25,320.00"
"ประสะมะแว้ง ตราหินทอง ชนิดเม็ด, ยาลูกกลอน","86","84","128","704.00"
"มะตูม, ยาชง","85","51","154","4,437.20"
"วาตาพินาศ (รพ.พระปกเกล้า), ยาแคปซูล","83","6","11,310","4,163,250.00"
"บรรเทาอาการปวดเมื่อยและแมลงกัดต่อย, ขี้ผึ้ง","83","68","83","3,735.00"
"บรรเทาริดสีดวงทวาร (รพ.แม่แจ่ม), ยาลูกกลอน","83","66","2,679","9,205.00"
"ริดสีดวงทวารแคปซูล สูตร 1, ยาแคปซูล","82","67","939","6,006.60"
"ยาต้มเบาหวาน ตำรับที่ 1, ยาต้ม","82","55","63","10,080.00"
"ตำรับมะเร็ง, ยาต้ม","80","24","204","4,200.00"
"บรรเทาริดสีดวงทวาร (รพ.ลี้), ยาแคปซูล","77","59","172","9,589.60"
"ทศเบญจกูล  , ยาแคปซูล","76","72","3,030","3,825.00"
"มหานิลแท่งทอง, ยาผง","75","0","9,146","3,717.00"
"วิสัมพญาใหญ่, ยาผง","74","59","8,925","15,947.00"
"ใบหม่อน-ใบเตย, ยาชง","71","64","83","1,689.00"
"แคปซูลผสมหญ้าปักกิ่ง ตราพระอินทร์, ยาแคปซูล","71","53","2,750","5,850.00"
"ทองพันชั่ง, ยาชง","71","12","926","4,304.00"
"นันทไกรวาทใหญ่, ยาแคปซูล","71","5","11,267","5,382,347.50"
"ประสะน้ำนม, ยาต้ม","70","25","157","7,850.00"
"เกสรทั้ง ๕, ยาต้ม","67","9","190","9,500.00"
"แก้อัมพฤกษ์ อัมพาตสูตร 1 (รพ.พระปกเกล้า), ยาแคปซูล","65","1","12,654","6,800,760.00"
"โรคภูมิแพ้, ยาแคปซูล","65","14","2,020","5,370.00"
"แคปซูลหญ้าปักกิ่ง ตราธงทอง, ยาแคปซูล","64","9","2,061","6,460.00"
"แคปซูลบัวบก, ยาแคปซูล","64","8","6,283","8,265.50"
"ตำรับมะระรวม  , ยาแคปซูล","64","60","3,081","5,105.25"
"หม่องสมุนไพรวังพรมตราหมอเฉลิม, ขี้ผึ้ง","64","56","64","3,392.00"
"ขับลม, ยาน้ำ","63","62","63","1,000.00"
"น้ำนมราชสีห์, ยาต้ม","62","5","226","11,015.00"
"ขมิ้นชัน-มะขามป้อม, ยาแคปซูล","62","56","1,231","3,693.00"
"ตวงกนก, ยาน้ำแขวนตะกอน","61","0","104","14,884.00"
"แคปซูลสมุนไพรตราฟิตเน่, ยาแคปซูล","60","58","237","6,810.00"
"สามว่าน, ยาต้ม","60","26","110","5,370.00"
"หม่องสมุนไพรตรานายพนัส, ขี้ผึ้ง","59","54","61","915.00"
"แคปซูลผสมมะรุม, ยาแคปซูล","59","40","2,462","4,473.00"
"ตำรับรากสามสิบ, ยาต้ม","57","2","215","10,750.00"
"แก้โลหิตตังพิการ (รพ.ตระการพืชผล), ยาแคปซูล","57","8","1,469","6,122.00"
"หอมเบอร์ 47, ยาเม็ด","56","33","2,241","2,241.00"
"ริดสีดวงแคปซูล, ยาแคปซูล","55","23","2,261","3,662.00"
"หม่องขาว ตราวังหลัง , ขี้ผึ้ง","53","1","103","2,678.00"
"ช้าพลู, ยาชง","51","42","176","10,040.00"
"แคปซูลส้มแขก, ยาแคปซูล","51","22","811","30,339.50"
"ฮีโมรินชนิดเม็ด, ยาเม็ด","50","47","1,150","1,725.00"
"ผสมกระเทียมสกัดชนิดเม็ดเครื่องหมายกการค้าขาวละออ, ยาเม็ด","49","19","3,980","12,133.00"
"แก้ท้องเสียเบอร์ 12, ยาแคปซูล","49","47","180","3,328.00"
"พรายเลือดพรายลม, ยาต้ม","48","19","72","3,907.80"
"ยาถ่าย (รพ.พนัสนิคม), ยาแคปซูล","47","11","52","4,220.00"
"ยาถ่าย (รพ.ประโคนชัย), ยาแคปซูล","45","36","286","2,660.00"
"บำรุงเลือด (รพ.กาบเชิง), ยาต้ม","45","25","62","3,925.00"
"ยาพอกสะเก็ดเงิน, ยาพอก","45","17","104","32,480.00"
"กวาดสมานลิ้นขาวละออเภสัช ชนิดเม็ด, ยาเม็ด","45","43","78","387.40"
"ยาระบาย ตราพรีราน่า, ยาแคปซูล","44","23","1,086","3,019.00"
"ลมปะกัง, ยาต้ม","44","34","44","2,012.00"
"เดมม่าครีม, ครีม","43","32","50","3,006.00"
"จิตรารมณ์, ยาแคปซูล","43","5","5,610","11,220.00"
"แก้โรคโลหิตระดู  , ยาต้ม","43","28","37","2,151.00"
"แคปซูลมะระขี้นก, ยาแคปซูล","42","40","850","3,325.00"
"ตรีเกสรมาศ / พิกัดเกสรมาศ, ยาชง","42","0","390","1,860.75"
"รักษาวัยทอง, ยาต้ม","42","25","101","4,879.00"
"บำรุงเลือด (รพ.ห้วยยอด), ยาลูกกลอน","42","41","119","5,510.80"
"ย่านางแดง, ยาชง","41","29","775","2,817.50"
"แก้ไอสมุนไพรสูตร 1, ยาเม็ด","40","37","49","1,082.00"
"แก้มุตตังพิการ(รพ.กุดชุม), ยาต้ม","39","36","45","2,836.00"
"ยาน้ำสะเก็ดเงิน, ยาน้ำ","39","28","82","4,140.00"
"ผสมเพชรสังฆาต สูตรตำรับที่ ๒, ยาแคปซูล","39","25","110","8,250.00"
"ยาต้มสะเก็ดเงิน, ยาต้ม","38","36","68","12,240.00"
"ตำรับข่อย, ยาลูกกลอน","38","25","267","1,553.50"
"แก้ร้อนใน, อื่นๆ","38","34","4,007","4,410.00"
"บำรุงเลือด (รพ.บางซ้าย), ยาแคปซูล","38","4","501","5,490.00"
"น้ำมันมะพร้าว, ยาเข้าน้ำมัน","37","13","46","3,890.00"
"บรรเทาริดสีดวงทวาร (วิทยาลัยการแพทย์แผนไทย ม.ราชมงคลธัญบุรี), ยาแคปซูล","37","22","924","1,209.00"
"แก้ไอเบอร์ 8, ยาผง","37","25","312","157.50"
"กษัยเส้นแสงสว่างตราค้างคาว, ยาแคปซูล","36","32","38","1,330.00"
"ธาตุสมดุลย์, ยาผง","35","22","681","1,398.00"
"เกษราธิคุณ/เกสราธิคุณ, ยาต้ม","34","0","162","378,396.00"
"แก้ไข้ตราลีลา, ยาเม็ด","33","26","784","2,050.00"
"ฟอกโลหิต , ยาต้ม","32","0","158","226,058.00"
