"พอกสมุนไพร, ยาพอก","2","2","2","103.00"
"ฝาง, ยาต้ม","2","2","2","33.00"
"ส้มแขก, ยาแคปซูล","2","0","0","0.00"
"เถาเอ็นอ่อน, ยาแคปซูล","2","2","58","116.00"
"พอกเข่าสมุนไพร, ยาพอก","2","2","3","660.00"
"พระอังคบพระเส้น ตำรับที่ 57, ยาประคบ","2","0","2","160.00"
"ผสมถั่วเหลือง, ยาแคปซูล","2","2","120","180.00"
"หอมแก้ลมวิงเวียน, ยาผง","2","0","0","0.00"
"เผาไพล, ยาผง","2","2","3","75.00"
"หม่องตะไคร้/หม่องตะไคร้หอม, ขี้ผึ้ง","2","2","28","2,240.00"
"อมผสมมะแว้งรสบ๊วย ตราไอยรา, ยาเม็ด","2","0","2","16.50"
"ประสะเจตพังคี, ยาแคปซูล","2","2","60","90.00"
"แคปซี บาล์ม, ขี้ผึ้ง","1","0","1","43.00"
"เบอร์นีเจล, ครีม","1","1","1","41.00"
"ชงสมุนไพรผสมรางจืด, ยาผง","1","1","1","30.50"
"แก้สัณฑฆาต กล่อนแห้ง, ยาแคปซูล","1","1","1","210.00"
"แคปซูลบำรุงโลหิต ตราทีเอฟดี, ยาแคปซูล","1","1","4","4.00"
"ยาหอม  , ยาผง","1","1","1","17.00"
"ว่านชักมดลูก, ยาแคปซูล","1","0","2","3.00"
"อไภยสาลี, ยาผง","1","0","2","0.00"
"ประสะกะเพรา, ยาแคปซูล","1","1","20","40.00"
"มังคุด/เปลือกมังคุด, ยาน้ำ","1","1","1","33.00"
"น้ำมันเขียว, ยาเข้าน้ำมัน","1","0","1","120.00"
"หม่องผสมไพล ตราวังหลัง, ขี้ผึ้ง","1","1","1","33.00"
"สามสิบ, ยาต้ม","1","1","1","20.00"
"แก้ไอมะขาม , ยาน้ำ","1","0","2","50.00"
"แคปซูลผสมเถาวัลย์เปรียง, ยาแคปซูล","1","1","9","9.00"
"กษัยเส้น, ยาลูกกลอน","1","1","1","40.00"
"อมหญ้าดอกขาว, ยาลูกกลอน","1","1","1","25.00"
"ทับทิม, ยาชง","1","1","1","12.50"
"บรรเทาริดสีดวงทวาร สูตร 2, ยาแคปซูล","1","1","18","21.60"
"ทิงเจอร์พลู, ทิงเจอร์","1","1","1","20.00"
"ทัพยาธิคุณ, ยาผง","1","1","2","38.00"
"ยาทาสะเก็ดเงิน, ขี้ผึ้ง","1","1","2","120.00"
"หม่องสูตรไพล ตราบี-บาล์ม, ขี้ผึ้ง","1","1","1","49.00"