"น้ำมันกระดูกไก่ดำ-ขัดมอญ, ยาเข้าน้ำมัน","2","1","5","300.00"
"มธุรเมหะ (รพ.วังน้ำเย็น), ยาลูกกลอน","2","2","12","20.04"
"เหงือกปลาหมอพริกไทย, ยาแคปซูล","2","2","120","108.00"
"อมผสมมะแว้งรสบ๊วย ตราไอยรา, ยาเม็ด","2","0","4","33.00"
"แก้ปิหกังพิการ, ยาแคปซูล","2","0","1,080","2,700.00"
"แก้นอนไม่หลับ/ยาแก้ไข้ผอมเหลือง, ยาผง","2","2","20","470.10"
"ยาอมสมุนไพร ตราช่อเขียวมะกอก รสกานพลู, ยาเม็ด","2","1","2","50.00"
"บำรุงตับ, ยาต้ม","2","1","2","60.00"
"บรรเทาริดสีดวงทวาร (รพ.ห้วยยอด), ยาลูกกลอน","2","2","2","1.00"
"ส้มแขก, ยาแคปซูล","2","0","0","0.00"
"สตรีเล่งคุณสำหรับหลังคลอดบุตร ชนิดแคปซูล, ยาแคปซูล","2","2","40","150.00"
"ถั่วเหลืองสกัด, ยาแคปซูล","2","1","262","656.50"
"ยาอาบ   หมอยาไทย, ยาผง","2","2","4","180.00"
"เหงือกปลาหมอ, ยาแคปซูล","2","2","2","140.00"
"ประสะน้ำนม (รพ.หนองสองห้อง), ยาต้ม","2","2","40","4,000.00"
"ฝาง, ยาต้ม","2","0","2","40.00"
"กล่อมนางนอน, ยาแคปซูล","2","2","24","48.00"
"ประสะเจตพังคี, ยาแคปซูล","2","0","40","60.00"
"น้ำมันทาถูนวด , ยาเข้าน้ำมัน","2","1","3","0.00"
"แก้พัทธะปิตตะ , ยาต้ม","2","0","12","4,272.00"
"ยาดมสมุนไพร, ยาดม","2","1","2","73.00"
"แคปซูลบำรุงน้ำนม, ยาแคปซูล","2","0","2","194.00"
"ชงกระเจี๊ยบ, ยาชง","2","2","20","80.00"
"หม่องผสมไพล ตราพรีราน่า, ขี้ผึ้ง","2","2","4","240.00"
"แก้ไอมะขามป้อม ตราเวชกร, ยาน้ำ","2","2","4","92.00"
"ถ่ายดีเกลือฝรั่ง , ยาแคปซูล","2","1","38","57.00"
"สุขไสยาต, ยาแคปซูล","2","0","2","0.00"
"ครอบไข้, ยาต้ม","2","2","2","180.00"
"สเปรย์รางจืด, ยาน้ำ","2","2","2","400.00"
"ยาหอม  , ยาผง","2","0","4","188.00"
"มันทธาตุ, ยาแคปซูล","2","2","92","253.00"
"อบเชย, ยาต้ม","2","0","6","39.00"
"ทับทิม, ยาชง","2","2","2","17.50"
"กันยุงตะไคร้หอม, ยาน้ำ","1","1","1","91.00"
"รักษาวัยทอง, ยาต้ม","1","0","0","0.00"
"พลู, ครีม","1","1","4","260.00"
"แก้ไอมะขาม , ยาน้ำ","1","0","2","50.00"
"กษัยเส้น, ยาลูกกลอน","1","1","10","15.00"
"แคปซูลอบเชย ตราธงทอง, ยาแคปซูล","1","0","6","9.00"
"น้ำแก้ไอผสมมะขามป้อม แสงสว่างตราค้างคาว, ยาน้ำ","1","1","1","15.50"
"หม่องสมุนไพร, ขี้ผึ้ง","1","1","1","30.00"
"แก้สัณฑฆาต กล่อนแห้ง, ยาแคปซูล","1","0","1","60.00"
"แผลไฟไหม้น้ำร้อนลวก, เจล","1","1","1","34.00"
"ประสะจันทน์แดง , ยาเม็ด","1","1","35","35.00"
"น้ำมันสนั่นไตรภพ, ยาเข้าน้ำมัน","1","0","1","1.00"
"อบหลังคลอด  หมอยาไทย, ยาผง","1","1","2","92.00"
"หม่องขมิ้นชัน, ขี้ผึ้ง","1","1","1","30.00"
"ผสมรางจืด, ยาแคปซูล","1","1","16","32.00"
"แคปซูลรางจืด, ยาแคปซูล","1","0","20","24.00"
"น้ำมันพริกไพล, ยาเข้าน้ำมัน","1","1","1","43.00"
"ทารักษาแผลในปาก, เจล","1","1","1","6.00"
"หม่องไพล/บาล์มไพล/ไพลบาล์ม/ขี้ผึ้งไพล, ขี้ผึ้ง","1","1","1","20.00"
"แคปซี บาล์ม, ขี้ผึ้ง","1","1","1","43.00"
"เบอร์นีเจล, ครีม","1","1","2","90.00"
"ยาพอกเข่า, ยาพอก","1","1","2","200.00"
"อมแก้ไอรสบ๊วย     , ยาลูกกลอน","1","0","1","15.00"
"ชงสมุนไพรผสมรางจืด, ยาผง","1","0","2","61.00"
"อโรติกา รัปโลชั่น, โลชั่น","1","0","1","84.50"
"ประคบใบหน้า/เต้านม, ยาประคบ","1","1","1","45.00"
"หม่องผสมไพล ตราวังหลัง, ขี้ผึ้ง","1","0","1","25.00"
"แก้ลมแก้เส้น, ยาผง","0","0","0","0.00"
"แคปซูลผสมรางจืด, ยาแคปซูล","0","0","0","0.00"
"ลมปะกัง, ยาต้ม","0","0","0","0.00"
"กำจัดเหา, ยาน้ำแขวนตะกอน","0","0","0","0.00"
"หม่องสมุนไพร / หม่อง / หม่องแก้ปวด, ขี้ผึ้ง","0","0","0","0.00"
"เสลดพังพอนคาลาไมน์, โลชั่น","0","0","0","0.00"
"มะตูม, ยาชง","0","0","0","0.00"
"ประสะกะเพรา, ยาแคปซูล","0","0","0","0.00"
"อมบ้วนปากกานพลู, ยาน้ำ","0","0","0","0.00"
"ว่านชักมดลูก, ยาแคปซูล","0","0","0","0.00"
"ตำรับหัวร้อยรู  , ยาต้ม","0","0","0","0.00"
"หม่องพริกไพล, ขี้ผึ้ง","0","0","0","0.00"
"ขมิ้นชัน-มะขามป้อม, ยาแคปซูล","0","0","0","0.00"
"หอมสินธร, ยาผง","0","0","0","0.00"
"แก้ไอมะนาว, ยาน้ำ","0","0","0","0.00"
"อไภยสาลี, ยาผง","0","0","0","0.00"
"แก้คัน, ยาน้ำแขวนตะกอน","0","0","0","0.00"
"อมหญ้าดอกขาว, ยาลูกกลอน","0","0","0","0.00"